Title,Date,Article
"선방위, 날씨 보도에 ‘파란색 1’ 쓴 MBC에 관계자 징계 의결",2024/04/04 17:06,"지난 2월 27일 MBC 뉴스데스크 일기예보 보도 화면. 2024.2.29. MBC뉴스데스크 방송화면 캡처일기예보에 파란색 숫자 ‘1’ 그래픽을 사용한 ‘MBC 뉴스데스크’에 대해 제22대 국회의원선거 선거방송심의위원회가 법정 제재 중에서도 수위가 높은 ‘관계자 징계’를 4일 의결했다.앞서 MBC 뉴스데스크는 지난 2월 27일 방송 말미 기상캐스터가 당일 미세먼지 농도가 1㎍/㎥까지 떨어졌다는 소식을 전하는 과정에서 파란색 숫자 1 그래픽을 사용했다. 국민의힘은 해당 화면이 더불어민주당을 연상시켜 선거방송심의규정 공정성 및 사실보도 조항 위반에 해당한다며 방송통신심의위원회에 제소했다. 국민의힘 한동훈 비상대책위원장도 “그간 민주당에 편향된 방송을 해온 MBC지만 이건 선을 넘은 것”이라고 비판했다.선방위는 4일 서울 양천구 목동 방송회관에서 회의를 열고 해당 방송분에 다수결로 ‘관계자 징계’를 의결했다. 선방위 결정은 ‘문제없음’, 행정지도 단계인 ‘의견제시’와 ‘권고’, 법정제재인 ‘주의’, ‘경고’, ‘프로그램 정정·수정·중지 및 관계자 징계’, ‘과징금’ 등으로 구분된다. 법정제재부터는 방송사 재허가·재승인 시 감점 사유로 적용돼 중징계로 인식된다.이날 회의에서는 다수 위원들이 해당 보도가 문제가 된다는 의견을 냈다. 권재홍 위원은 “당일 서울 시내 평균 미세먼지 농도가 1도 아니어서 뉴스 가치가 없는데 1을 부각했다”고 지적했다. 임정열 위원도 “순수한 날씨 정보였다면 1 옆에 ‘미세먼지 농도’라고 자막이나 단위를 표시했어야 한다”고 말했다. 김문환 위원도 “선거운동 기간 미디어가 전하는 내용은 유권자에게 중대한 영향을 미친다”고 밝혔다.의견 진술에 참석한 박범수 MBC 뉴스룸 취재센터장은 “가벼운 날씨 보도에 대해 정치 프레임을 씌워 공격한 것을 선방위에서 정색하고 심의할 사안이라고 생각하지 않는다”며 “심의 자체가 언론 탄압의 요소가 있다”고 반박했다. 이어 “편파 보도는 매섭게 질책해야 하지만 이 날씨 보도가 그에 해당한다고 하는 건 국민 수준을 너무 낮게 보는 것”이라고 주장했다.심재흔 위원도 “한 위원장도 지금은 자신의 발언(날씨 보도에 대한 비판)을 후회하고 있을 것”이라며 “이런 문제가 자꾸 표면화되니 언론 탄압한다는 뉴스가 나온다”는 소수 의견을 제시했다. 이에 백선기 위원장은 “(MBC 측이) 정치적 의도가 전혀 없었다 할지라도 민원이 제기됐다. 사후에라도 문제 됐으면 선방위는 심의를 해야 한다”며 “향후 뉴스 제작에 반영했으면 한다”고 말했다.김소영 동아닷컴 기자 sykim41@donga.com"
대전서도 사전투표소 2곳에서 불법 카메라 발견,2024/03/30 19:07,22대 국회의원 총선거를 앞두고 경남 양산과 인천의 사전투표소 9곳에서 불법 카메라가 발견돼 경찰이 조사를 벌이고 있는 가운데 29일 대전 서구 갈마2동 행정복지센터에 설치될 사전투표소에서 서구청 직원들이 불법 카메라 탐지기계로 점검하고 있다. 2024.3.29/뉴스1대전에서도 제22대 국회의원선거 사전투표소 2곳에서 불법 카메라가 발견됐다.30일 대전시선거관리위원회와 대전경찰청에 따르면 사전투표소에 불법 카메라를 설치한 40대 유튜버 한 모 씨를 수사하던 중 한 씨가 대전지역에서도 불법 카메라를 설치한 것으로 확인됐다.인천 논현경찰서로부터 이 사실을 전달받은 경찰은 전날 오후 4시 대전선관위와 합동 조사를 실시해 대전 중구 문화1동 2층 복도와 유천2동 복도에서 불법 카메라를 발견해 회수 조치했다.불법 카메라를 설치한 40대 유튜버 한 모 씨는 평소 개표기 조작과 대리 투표 등 부정선거 의혹을 제기해 온 극우 성향 유튜버인 것으로 파악됐다. 한 씨는 경찰 조사에서 “사전투표율 조작 등 부정선거를 감시하기 위해 설치했다”고 진술했다.그는 2022년 대선과 지난해 10월 치러진 서울 강서구청장 보궐선거 때도 한 사전투표소에 카메라를 설치해 촬영했던 것으로 드러났다. 한 씨는 당시 촬영한 영상을 토대로 자신이 운영하는 유튜브 채널에서 부정선거 의혹을 제기했다.대전경찰은 피의자 진술과 증거자료를 토대로 본청 및 전국 경찰서와 공조해 수사할 방침이다.송치훈 동아닷컴 기자 sch53@donga.com
[온라인 라운지]국토 최남단 마라도에서 투표참여홍보 캠페인,2024/04/04 16:06,"제주특별자치도선거관리위원회는 전농로벚꽃축제, 서귀포유채꽃축제 캠페인에 이어 제22대 국회의원선거 등 사전투표를 앞두고 4. 4.(목) 대한민국 최남단인 마라도에서 지역주민과 관광객을 대상으로 투표참여를 홍보하는 캠페인을 실시했다.크게보기제주특별자치도선거관리위원회 직원들이 마라도 ‘대한민국최남단기념비’ 앞에서 투표참여 캠페인을   펼치고 있다. 제주특별자치도선거관리위원회 제공크게보기최혁중 기자 sajinman@donga.com"
‘62.8%’ 역대급 재외선거 투표율…여야 어느 쪽 웃을까,2024/04/02 17:47,"제22대 국회의원선거 재외국민 투표 첫날인 27일(현지시간) 프랑스 파리 주프랑스한국대사관 영사부에 설치된 재외투표소에서 유권자가 투표하고 있다. 2024.3.27/뉴스122대 총선 재외선거 최종 투표율이 62.8%로 역대 최고치를 경신했다. 윤석열 정권이 들어선 이후 처음 치러진 재외선거인 만큼 관심도가 높아진 것으로 보인다.선관위에 따르면 지난달 27일부터 이달 1일까지 115개국 220개 투표소에서 재외투표를 진행한 결과 투표자 수는 9만2923명, 최종투표율은 62.8%로 집계됐다.선관위에 따르면 이번 총선 재외선거의 재외유권자 수는 총 14만7989명(국외부재자 11만 9897명, 재외선거인 2만 8092명)이다.재외선거는 지난 2012년 제19대 총선부터 도입됐는데, 투표율이 60%대를 넘긴 것은 이번이 처음이다. 역대 투표율은 19대 45.7%, 20대 41.4%였으며, 21대는 23.8%였다.21대 총선의 경우 코로나 바이러스 감염증(코로나19)으로 59개국 91개 재외공관에서 선거 사무가 중단돼 절반가량의 재외국민만 투표할 수 있었고, 저조한 투표율을 기록했다.코로나19 이후 정상적으로 치러진 선거인 데다, 윤석열 정권 들어 처음 진행된 재외선거인 만큼 뜨거운 관심을 보인 것으로 분석된다.선관위 관계자는 “지난 19대 5만 6456명, 20대 6만 3797명에 비하며 투표자 수가 크게 늘었다”며 “유권자들이 이번 총선에 대한 관심도가 높아진 듯하다”고 말했다.통상적으로 재외투표율이 높을수록 진보정당에 유리하다. 이번에 역대급 투표율을 기록한 만큼 민주당에 유리할 거라는 관측도 나온다.지난 2022년 치러진 20대 대선 결과를 보면 이번 총선에서도 야권에 유리할 가능성이 높다. 재외투표 개표결과 이재명 민주당 후보가 8만 8397표(59.77%)를 얻어 윤석열 당시 후보(5만 3524표, 36.19%)를 제친 바 있다.이재명 민주당 대표도 “여러 번거로움과 어려움을 이겨낸 역대급 재외선거 투표율, 정권 심판과 새 나라에 대한 열망의 목소리”라며 사전투표를 독려했다.박상병 정치평론가는 통화에서 “재외선거의 경우 국내 정치에 관심이 있는 사람들이 투표를 한다”며 “이종섭 호주대사 사태를 비롯해 외교 문제 등에서 심판 여론이 있을 것”이라고 내다봤다.엄경영 시대정신연구소장도 통화에서 “조국혁신당 바람으로 야권 지지층이 결집하면서 투표율이 높아진 것으로 보인다”며 “보수층의 역결집도 있겠지만 상대적으로 야당에 유리할 수 있다”고 했다.반면, 신율 명지대 교수는 “투표자 수가 9만여 명밖에 되지 않아 총선 결과에 미칠 영향은 미미할 것”이라고 했다.재외선거의 높은 투표율이 최종적으로 높은 투표율로 직결될지는 미지수다. 지난 19, 20대 총선의 경우 최종투표율이 재외선거 투표율보다 15%p 이상 높았다.엄 소장은 “이번 총선에 대한 관심도가 높아졌지만 아직 2030 세대는 반응하지 않고 있다”며 “지난 총선 투표율(66.2%)을 넘길 수 있을지는 지켜봐야 한다”고 말했다.한편, 국외부재자의 경우 국내에 주민등록, 거소등록이 돼 있는 전근자나 유학생 등으로 본인이 등록된 지역구 국회의원까지 뽑을 수 있다. 반면 해외 영주권을 가지는 등 주민등록이 돼 있지 않은 재외선거인은 비례대표 정당만 뽑을 수 있다.(서울=뉴스1)"
인천 사전투표율 30.06% 역대 최고…최종 70% 넘어 하위권 탈출 기대,2024/04/09 17:44,"제22대 국회의원선거를 하루 앞둔 9일 오전 경기도 과천시 중앙선거관리위원회 상황실에서 직원이 제22대 국회의원선거 관내 사전투표함과 우편투표함 보관장소 CCTV를 살펴보고 있다. 2024.4.9 뉴스122대 총선 인천의 사전투표율이 역대 총선 최고치를 경신하면서 최종 투표율이 70%를 넘어설지 관심이 쏠린다.9일 인천시선거관리위원회에 따르면 오는 10일 오전 6시부터 오후 6시까지 22대 국회의원을 뽑는 선거가 일제히 실시된다. 인천지역은 총 738개 투표소에서 투표할 수 있다.인천 유권자 258만 2765명 중 77만 6408명은 지난 5~6일 사전투표에 참여해 30.06%의 사전투표율을 기록했다. 이는 지난 20대 총선 당시 10.81%에 비해선 19.25%p 높고, 기존 최고 기록이었던 21대 총선 24.75%보다도 5.31%p 높은 역대 총선 최고치다.그러나 전국 평균 31.28%보다 1.22%p 낮고 순위도 전국 17개 시·도 중 13위에 머물렀다. 이 같은 투표율 저조는 최근 6번의 총선에서 고스란히 드러났다.지난 16대 총선 인천 투표율은 전국 평균 57.2%보다 3.8% 밑도는 53.4%로 전국 16개 시·도 중 15위에 머물렀다. 17대(57.4%)·18대(42.5%) 총선에서도 순위는 변동이 없었으며 19대(51.4%)에는 더 떨어져 17개(세종시 포함) 시·도 중 꼴찌를 기록했다.20대(55.6%)에는 14위를 차지해 소폭 반등했지만 21대(63.2%) 때 다시 15위로 1계단 내려갔다.지역 정가는 이번 총선 인천지역 최종 투표율은 70% 안팎이 될 것으로 분석한다.민주당을 비롯한 범야권이 내세우는 ‘정권 심판론’과 국민의힘의 ‘이·조(이재명·조국) 심판론’ 격돌이 강해 다른 총선 때보다 더 많은 유권자들을 투표소로 끌어들일 수 있다는 얘기다. 다만 인천 투표율이 전국 평균보다 높게 나올지는 미지수다.정가의 한 인사는 “현재의 총선 이슈는 인천만의 이슈가 아닌 전국적 현상”이라며 “인천만의 큰 이슈가 없는 한 인천 투표율이 상위권으로 도약하기 힘들어 보인다”고 말했다.이어 “이번 사전투표율이 21대 총선 24.75%보다 5.31%p 높아 최종 투표율은 70% 가까이 될 것으로 예상된다”고 말했다.선거일 투표는 주민등록지를 기준으로 선거인별 지정 투표소에서만 가능하다. 지정 투표소 위치는 각 가정에 발송된 투표안내문 또는 투표소 찾기 연결 서비스, 지방자치단체의 ‘선거인명부 열람시스템’에서 찾을 수 있다.선거인은 투표 안내문에서 투표 시간과 장소를 확인한 뒤 함께 기재돼 있는 선거인명부 등재 번호를 메모해 가면 신속·정확하게 본인 확인을 할 수 있다.투표할 땐 본인 확인을 위한 신분증(모바일 신분증 포함)을 반드시 갖고 가야 한다. 주민등록증, 여권, 운전면허증, 청소년증 및 각급 학교 학생증 등 관공서 또는 공공기관이 발행한 신분증명서로서 생년월일이 기재되고 사진이 포함돼 본인임을 확인할 수 있어야 한다.모바일 신분증(모바일 운전면허증, 모바일 국가자격증 등)의 경우 투표에 앞서 앱 실행 과정 및 사진, 성명, 생년월일을 확인하며, 화면 캡처 등을 통해 저장한 이미지 파일은 신분증으로 인정되지 않는다.(인천=뉴스1)"
"與, ‘이대생 미군 성상납’ 발언 김준혁·옹호한 조상호 고발",2024/04/04 15:29,"제22대 국회의원선거 수원정에 출마한 김준혁 더불어민주당 후보가 14일 오후 경기도 수원시 영통구 경기도의회 브리핑룸에서 열린 수원 지역 후보 합동 공약 발표 기자회견에서 발언을 하고 있다. 2024.3.14. 뉴스1국민의힘은 4일 ‘이화여대생 성 상납’ 발언으로 논란을 일으킨 더불어민주당 김준혁 후보(경기 수원정)와 김 후보를 옹호한 민주당 조상호 법률위원회 부위원장을 명예훼손 혐의로 대검찰청에 고발했다.국민의힘 중앙선거대책위원회 클린선거본부는 이날 언론 공지를 통해 “국민의힘과 이화여대 출신 김정재 의원은 오늘 김 후보와 조 부위원장을 각각 정보통신망 이용 촉진 및 정보보호법 위반(명예훼손) 혐의로 검찰에 고발했다”고 밝혔다.앞서 김 후보는 2022년 8월 한 유튜브에서 “(김 총장이) 미군정 시기에 이화여대 학생들을 미군 장교에게 성 상납시켰다”고 말한 사실이 뒤늦게 알려져 이화여대 측의 반발을 샀다. 김 후보는 지난 2일 논문과 기사 등을 근거로 반박에 나섰지만, 민주당이 사과를 권고하자 “상처를 입힌 점에 깊은 사과를 드린다”며 고개를 숙였다.그러나 사과 하루 만인 3일 조 부위원장이 김 후보를 옹호하고 나섰다. 그는 한 방송에 나와 김 후보 발언에 대해 “역사학자가 역사학자로서 역사적 사실에 대해 언급한 것”이라면서 “김활란 초대 이화여대 총장이 총재로 있던 ‘낙랑클럽’이 실제 매춘과 유사 매춘에 이용됐다는 측면에서 여러 묘사가 나온다”고 주장했다.클린선거본부는 “김 후보가 논문을 근거로 ‘김활란이 성 접대를 주도했다는 기록이 있다’고 반박했으나, 해당 논문에는 ‘성 상납’, ‘성 접대를 주도했다’는 표현이 발견되지 않았다”며 “김 후보가 별다른 근거 없이 허위 사실을 발언해 이대 재학생과 졸업생의 명예를 훼손했다”고 지적했다.이어 조 부위원장에 대해선 “김 후보를 옹호해 이대 재학생과 졸업생의 명예를 2차 침해했다”며 “민주당 지도부 요청으로 김 후보가 사과한 척했으나, 민주당 법률전문가라는 조 부위원장의 발언으로 민주당의 끝없는 여성 인권 유린 등 적나라한 정체가 온 국민에게 드러났다”고 꼬집었다.국민의힘 박정하 중앙선대위 공보단장도 이날 논평에서 “민주당 후보들의 성인지 감수성은 처참함을 넘은 수준의 바닥을 드러냈다”고 지적했다.한편 60개 여성단체로 구성된 ‘찐(眞)여성주권행동’은 이날 오전 11시 경기 수원시 영통구 김 후보 선거 사무실 앞에서 기자회견을 열고 김 후보의 사죄를 촉구했다. 이어 오후 2시에는 여성단체 전국여성포럼 회원들이 김 후보 사무실 앞을 찾아 피켓 시위를 벌였다. 이날 오후 5시에는 이대 졸업생·재학생들이 이대 대강당에서 김 후보 규탄 집회를 연다.김소영 동아닷컴 기자 sykim41@donga.com"
인천시 사전투표소서 불법 카메라 발견…시·선관위 전수조사,2024/03/28 20:21,기사 사건과 무관한 사진. 제22대 국회의원선거 재외국민 투표 첫날인 27일(현지시간) 프랑스 파리 주프랑스한국대사관 영사부에 설치된 재외투표소에서 유권자가 투표하고 있다. 2024.3.27/뉴스1인천시 내 사전투표소에 불법으로 설치된 카메라가 여러 대 발견돼 인천시와 인천시 선거관리위원회가 조사 중이다.28일 인천시 선관위에 따르면 남동구와 계양구에서 사전투표소로 지정된 행정복지센터 5곳에서 불법 카메라가 발견됐다. 이 카메라들은 사전투표함을 촬영하는 각도로 설치돼 있던 것으로 알려졌다.인천시 선관위 관계자는 “불법으로 추정되는 카메라가 발견됐다”며 “현재 사전투표소를 인천시 관계자 등과 전수 조사 중”이라고 했다. 점검 대상 사전투표소는 인천 10개 군·구 159개소다.최근 경남 양산시 내 사전투표소로 지정된 행정복지센터에서도 불법 카메라가 발견돼 행정안전분가 전국 지방자치단체에 긴급 점검을 요청하기도 했다. 행안부는 오는 29일까지 점검 현황을 파악해 대책을 마련할 방침이다.이예지 동아닷컴 기자 leeyj@donga.com
"행안부, 사전투표소 최종 현장 점검…불법카메라 탐지도",2024/04/04 15:13,"제22대 국회의원선거 사전투표를 하루 앞둔 4일 서울 강남구 삼성2동 주민센터에 마련된 사전투표소에서 선거관리위원회 관계자가 카메라탐지기와 금속탐지기를 이용해 불법카메라 설치 점검을 하고 있다. (공동취재) 뉴스1정부가 제22대 국회의원 선거 사전투표를 하루 앞두고 최종 현장 점검에 나섰다.행정안전부에 따르면 이상민 행안부 장관은 4일 서울 종로구 사직동 주민센터에 마련된 사전투표소를 방문했다.이 장관은 기표소 및 투표함 설치 상태, 장애인을 위한 투표 편의시설 등 투표소 시설 전반을 점검했다.특히 최근 일부 사전투표소에서 불법카메라가 발견된 만큼, 전문 탐지장비를 활용해 불법카메라 설치 여부에 대한 점검도 진행했다. 앞서 경찰은 전국 3565곳 사전투표소 중 36곳에서 불법카메라를 적발해 수사를 진행 중이다.이 장관은 이날 사전투표 모의시험을 참관하고 신분증 확인, 투표용지 발급 등 사전투표 준비 상황을 확인했다.이 장관은 “불법카메라 설치는 선거의 공정성을 해치는 중대한 범죄행위”라며 “국민께서 안심하고 투표에 참여할 수 있도록 선거 준비에 만전을 기하고, 남은 선거기간 사전투표소뿐 아니라 투표소와 개표소도 꼼꼼히 점검해 달라”고 당부했다.이번 총선 사전투표는 오는 5, 6일 이틀간 진행된다. 투표 시간은 오전 6시부터 오후 6시까지다. 선거권이 있는 사람이면 누구나 신분증을 지참한 뒤 가까운 읍·면·동주민센터 등에 마련된 사전투표소에서 투표할 수 있다.이혜원 동아닷컴 기자 hyewon@donga.com"
"한국여성단체협 “‘성상납 발언’ 김준혁, 후보 사퇴 안하면 고발”",2024/04/02 15:25,"제22대 국회의원선거 수원정에 출마한 김준혁 더불어민주당 후보가 14일 오후 경기도 수원시 영통구 경기도의회 브리핑룸에서 열린 수원 지역 후보 합동 공약 발표 기자회견에서 발언을 하고 있다. 2024.3.14. 뉴스1한국여성단체협의회가 2일 ‘이화여대생 미군 장교 성 상납 발언’으로 논란에 휩싸인 더불어민주당 김준혁 후보(경기 수원정)를 향해 사퇴를 촉구했다.협의회는 이날 성명을 내고 “명확한 근거도 없이 이화여자대학교 초대 총장이자 협의회 초대 회장이었던 김활란 박사와 이화여대, 재학생 및 졸업생 전체는 물론 대한민국 여성의 명예를 심각하게 훼손한 김 후보를 강력히 규탄한다”고 밝혔다.협의회는 “김 후보는 2022년 8월 ‘김활란 초대 회장이 미군정 시기 이화여대 학생들을 미군 장교들한테 성 상납시켰다’는 발언을 했다”며 “저급한 언행으로 역사를 왜곡하고 대한민국의 모든 여성에게 치욕감과 모욕감을 줬다. 국회의원 후보라는 사람이 할 말과 하지 말아야 할 말 정도는 구별할 줄 아는 양식을 가져야 되지 않겠나”라고 비판했다.이어 김 후보를 향해 “김활란 박사와 이화여대에 관한 발언에 대해 즉시 한국여성단체협의회와 이화여대, 대한민국 여성들에게 사과하고 즉각 후보에서 사퇴할 것을 강력히 요구한다”고 목소리를 높였다. 그러면서 “만일 이 요구가 받아들여지지 않을 경우 협의회 500만 회원들은 김준혁 후보를 명예훼손으로 고발할 것”이라고 강조했다.앞서 김 후보는 지난 2022년 8월 한 유튜브 채널에서 “종군 위안부를 보내는 데 큰 역할을 한 사람이 바로 김활란”이라며 “미군정 시기에 이화여대 학생들을 미군 장교들에게 성 상납시켰다”고 주장했다.해당 발언이 뒤늦게 논란이 되자 김 후보는 2일 페이스북을 통해 “5~6년 전 유튜브에 출연해 나눴던 발언을 꼬투리 삼아 앞뒤 다 자르고 성(性)과 관련된 자극적인 부분만 편집해 저와 민주당 전체를 매도하고 있다”면서 “제 주장은 친일 인사들의 문제가 되는 행적, 특히 우리나라 여성들의 인권을 유린하고 성 착취를 강요했던 숨겨진 아픈 역사를 제대로 알자는 것”이라고 반박했다.김소영 동아닷컴 기자 sykim41@donga.com"
