Title,Date,Article
"“남자들 룸 한번만, 여자들 백 작작”…‘막말 논란’ 장예찬 재차 사과 “100번 후회”",2024/03/15 14:44,"장예찬 전 국민의힘 청년최고위원이 지난 1월 9일 오전 서울 여의도 국회 소통관에서 기자회견을 갖고 제22대 국회의원선거 출마선언을 하고 있다. 뉴스1부산 수영구 공천을 받은 국민의힘 장예찬 후보가 과거 부적절한 발언이 잇따라 도마 위에 오르자 “다시금 국민 여러분께 진심으로 고개 숙여 사죄드린다”고 재차 사과했다.15일 장 후보는 페이스북을 통해 “10여 년 전, 25세 무렵 페이스북에 남겼던 글들이 국민께 심려를 끼치고 있다. 대부분 이전에 삭제한 것이지만 캡처된 사진이 남아 논란을 일으키게 된 점을 무거운 마음으로 사과드리고 싶다”고 밝혔다.앞서 장 후보는 2014년 페이스북에 “매일 밤 난교를 즐기는 사람이라도 맡은 직무에서 전문성과 책임성을 보이면 프로로서 존경받을 수 있는 사회가 건강한 사회”라고 쓴 사실이 알려져 논란이 일자 12일 사과했다.하지만 이후에도 10여 년 전 작성한 페이스북 글이 재차 논란이 됐다. 그는 “동물병원 폭파하고 싶다”, “(서울시민의) 교양 수준이 일본인의 발톱 때만큼이라도 따라갈 수 있을까 싶다”, “(한국컴패션) 추가 후원 결심. 남자들은 룸(룸살롱) 두 번 갈 거 한 번만 가면 몇 명을 후원할 수 있는 거냐. 여자들은 백 좀 작작 사시고”, “책값 아깝다고 징징거리는 대학생들이 제일 한심하다”고 적었다.또 관광지에서 사진 찍는 여성을 두고 “그렇게 수십 장을 찍어봐야 못생긴 얼굴이 예쁘게 나오지 않는다”는 글을 올리기도 했다.장 후보는 이날 “어려운 아이들에게 후원을 독려하면서 쑥스러운 마음에 일부러 강한 표현을 썼고, 아르바이트를 하며 여러 민원에 시달리다 부적절한 표현을 남기기도 했다”며 “당시에는 방송 등의 공적 활동을 하기 전이고, 지금과 달리 소수의 친구만 있던 사적 공간이라 치기 어린 표현을 가볍게 남겼다”고 해명했다.이어 “정치와 사회에 불만도 많고, 하고 싶은 말도 많은 20대였으나 정제된 표현으로 자신을 다듬을 줄 몰랐다. 당시 페이스북 글을 가까운 친구가 아닌 사람들이 보게 될 거라는 생각도 하지 못했다”며 “돌아보면 20대 초중반 시절의 제 언행이 너무 부끄럽고 죄송스럽다. 아무리 어렸을 때라도 더 신중하고 성숙했으면 어땠을까 10번 100번 후회하고 있다”고 했다.그러면서 “저는 여전히 부족한 사람이지만 방송 활동을 시작하고는 생각과 발언을 정제하기 위해 노력해 왔다. 어느 방송에서도 20대 초중반 때와 같은 생각을 한 적도, 발언을 하지도 않았다”며 “앞으로 제가 우리 사회를 위해 어떤 봉사를 하게 되더라도 철없는 20대 시절을 거울삼아 철저하게 낮은 자세로 신중하고 성숙한 모습을 보이겠다”고 덧붙였다.한편 장 후보를 둘러싼 ‘막말 논란’이 이어지자 국민의힘 장동혁 사무총장은 이날 오전 서울 여의도 중앙당사 출근길에 기자들과 만난 자리에서 “발언 내용이나 문제 되는 지점, 국민에게 어떻게 받아들여지는지, 보도에 대한 후보자 입장 등 여러 사정을 고려하면서 지켜보겠다”고 했다.이혜원 동아닷컴 기자 hyewon@donga.com"
"나경원 “정부, 의료계와 의대증원 논의해야…민심 순응할 차례”",2024/03/30 12:23,"제22대 국회의원선거 서울 동작을에 출마한 나경원 국민의힘 후보가 29일 오전 서울 동작구 성대시장에서 지지를 호소하고 있다. 2024.3.29/뉴스1국민의힘 공동선거대책위원장인 나경원 동작을 후보는 30일 “의대 증원 문제와 관련해 정부와 의료계는 모든 의제를 협상테이블에 올려놓고 새롭게 논의를 시작해야 한다”고 촉구했다.나 후보는 이날 페이스북을 통해 “용감하게 쓴소리하겠다. 제2의 이종섭 대사 문제는 앞으로 없을 것”이라며 이같이 밝혔다. 의정 갈등이 수도권 지지율에 악영향을 주자 정부를 향해 태도 변화를 주문하고 나선 것이다.그는 “의료 현장 공백부터 해소해야 한다”며 “국민은 이미 정부의 의지를 충분히 확인했다. 그다음으로 국민은 정부의 유연한 태도를 기다리고 있다. 민심에 순응할 차례”라고 강조했다.나 후보는 또 “국민의 불안과 피로가 무섭게 쌓이고 있다”며 “민심에 따라 바뀔 수 있어야 하는 것이 정치”라고 했다.그러면서 “왜 이렇게까지 됐을까. 왜 여기까지 와야 했을까. 무거운 마음으로 국민의힘을 돌아보게 된다”며 “국민의 실망과 질타를 적극적으로 정부에 전달하고 변화를 주도하는 역할에 충실하지 못했다”고 전했다.나 후보는 “그러나 이대로 극한의 갈등과 대립을 예고하는 민주당과 조국혁신당에 22대 국회를 통째로 넘길 수는 없다”며 “국민의힘도 참 못났지만, 민주당과 조국혁신당은 위험하다”고 말했다.이어 “이재명 대표, 조국 대표의 사적 원한에 나라 운명을 맡길 수는 없다. 민생과 경제가 더 힘들어질 것”이라며 “국민께 간곡히 부탁드린다. 최소한의 힘만이라도 허락해 주셨으면 한다”며 지지를 호소했다.(서울=뉴스1)"
선거 공소시효는 6개월인데 쏟아진 고소·고발…“제대로 수사 가능할까”,2024/04/09 17:46,"제22대 국회의원선거 본투표를 하루 앞둔 9일 오후 서울 종로구 삼일대로 종로 1234가동 주민센터에 마련된 투표소에서 관계자들이 막바지 점검을 하고 있다. 2024.4.9. 뉴스122대 총선을 하루 앞두고 선거 관련 고소·고발 사건이 산적히 쌓인 것으로 나타났다. 경찰은 총선 정국에 하루 수백건의 고소·고발이 접수되고 있다고 토로했다. 이에 일각에서는 정치적 목적의 고소·고발로 민생 범죄 수사에 지장을 줄 정도로 공권력이 낭비되고 있다는 지적이 나온다.경찰은 4·10 총선이 끝난 뒤 신속히 수사에 나선다는 방침이지만, 선거사범에 대한 공소시효가 6개월밖에 안돼 ‘벼락치기 수사와 기소’가 반복될수밖에 없다는 비판도 제기된다.◇하루 평균 100여건 신고…약 3개월간 경찰 적발 선거 사범 896명선거 관련 신고는 시민단체 고발부터 후보 간 맞고소·고발전으로까지 줄줄이 이어지고 있다.지난 8일 김기표 더불어민주당 경기 부천을 후보 측은 경쟁 상대인 박성중 국민의힘 후보를 공직선거법 위반 혐의로 경찰에 고발했다.김 후보 측은 고발장을 통해 “박 후보는 김 후보가 변호사 시절 수임료 5000만 원을 현금으로 수령했다는 이유로 현금다발을 청탁용으로 사용했다는 취지의 글을 지난 5일 문자메시지 등을 통해 발송해 허위사실을 공표했다”고 주장했다.박성민 국민의힘 울산 중구 후보는 자신의 비리 의혹을 문자메시지로 발송한 오성택 민주당 후보를 경찰에 고발했다. 해당 문자에는 현역 의원인 박 후보가 삼청교육대에 입소한 사유와 불법 쪼개기 후원을 받은 데 대해 해명해야 한다는 내용이 담겼다.이에 대해 박 후보는 “삼청교육대는 D등급을 받았다고 했고, 국방부 정보공개로는 나오지 않는다. 후원금과 관련해서는 조사를 받은 적도 없다”고 반박했다.경찰에 따르면 총선 예비후보 등록이 시작된 지난해 12월 12일부터 올해 3월 26일까지 적발한 선거 사범은 총 895명이다. 서울경찰청에 따르면 22대 총선 사전투표 기간 경찰에 접수된 관련 신고는 하루 평균 80~100건 정도였던 것으로 집계됐다.경찰은 총선 관련 고발 사건을 10일 총선이 끝난 뒤 공소시효 만료 전 신속히 수사한다는 방침이다.그러나 전문가들은 지나친 고소·고발이 행정력을 낭비하고 있다고 지적한다.곽대경 동국대 경찰사법대학 교수는 “선거철 고소·고발 남발로 행정력 낭비가 심해지는 측면이 있다”며 “아니면 말고 식으로 고소·고발을 해 수사 기관에 부담을 주는 행위가 바람직하다고 보기 어렵다”고 말했다.이창현 한국외대 법학전문대학원 교수도 “정치권이 고소·고발을 선거에 악용하는 나쁜 관행을 개선해야 한다”며 “이건 제도의 문제라기보단 의식을 개선해야 하는 문제”라고 짚었다.◇6개월 공소시효도 쟁점…“벼락치기 기소 문제” vs “선거사범 신속처리 필요”공직선거법 공소시효에 대한 논란도 선거철마다 반복되고 있다. 선거일로부터 6개월로 제한된 기간이 지나치게 짧아 경찰이 시효가 임박해 선거법 위반 사건을 송치하고, 검찰이 벼락치기 기소를 하는 일이 생긴다는 지적이다.이에 대해 이 교수는 “경찰 수사부터 검찰 기소까지 하려면 6개월은 너무 짧고, 수사 지휘도 제대로 안 된다”며 “선거사범 공소시효를 짧게 했을 때 장점도 있어서 일반 사건과 구별되는 지점도 있지만, 수서 어려움을 고려해 1년 정도로 늘리는 편이 좋을 것”이라고 밝혔다.그러나 선거 사범을 신속하게 처리하고, 선거 결과에 따른 정치 활동이 안정될 수 있도록 한 입법 취지를 고려 했을 때 6개월 공소시효가 불가피하다는 의견도 있다. 공소시효를 길게 가져가면 선거 결과를 무효화하려고 정치적 목적의 고소·고발이 폭증할 수 있다는 우려다.이 때문에 현행 공직선거법 전신인 공직선거 및 부정선거방지법이 처음 시행된 1994년 3월부터 30년간 공소시효 6개월은 그대로 유지되고 있다는 것이다.곽 교수는 “사안에 따라 양쪽 이야기들이 다 일리가 있을 수 있다”며 “구체적인 사건을 놓고 따져봐야 한다”고 말했다.(서울=뉴스1)"
‘뜨거운 화성을’…이준석 출마로 민주 공영운-국힘 ‘3자 대결 구도’,2024/03/04 16:28,"이준석 개혁신당 대표가 4일 오후 경기도 화성시 정조로 동탄호수공원에서 제22대 국회의원선거 화성을 출마 선언을 하고 있다. 2024.3.4 뉴스1이준석 개혁신당 대표가 4일 오후 경기도 화성시 정조로 동탄호수공원에서 제22대 국회의원선거 화성을 출마 선언을 하고 있다. 2024.3.4 뉴스1경기 화성을 선거구가 주목받고 있다. 개혁신당 이준석 대표가 평균 연령 30대 중반인 동탄2신도시를 4·10총선 출마 지역으로 결정지으면서다.4일 오후 출마를 선언한 이 대표와 함께 더불어민주당 영입 인재인 공영운 전 현대자동차 사장, 아직 후보자를 결정하지 못한 국민의힘 등으로 화성을은 3자 대결 구도가 형성될 전망이다.국민의힘은 이날 이준석 개혁신당 대표가 출마를 선언한 경기 화성을에 대해 “어떤 분을 배치할지 전략적으로 다시 한번 고민해 보겠다”고 밝혔다.앞서 이날 이 대표는 동탄2 호수공원에서 기자회견을 열고 화성을 출마를 공식 선언했다.그는 “제가 기대고 믿는 것은 동탄의 젊은 세대에 대한 확신”이라며 “동탄을 대한민국 중심도시로 만들겠다”고 포부를 밝혔다.이어 “우선 동탄의 스피커가 되겠다”며 “동탄이 발전하기 위해서는 대한민국 정치의 중심에서 누군가는 동탄을 외치고 있어야 한다”고 덧붙였다.그는 또 “개혁신당을 통해 완전히 새로운 동탄의 청사진이 태어날 것”이라며 “앞으로 동탄의 미래를 직접 만들어가는 정치를 해나가겠다”고 강조했다.그는 “고교 비평준화 지역으로 많은 동탄 학부모들이 어려움을 겪고 있는 데, 이 문제를 반드시 해결하겠다”면서 “경기남부에서 수많은 미래 과학 인재가 배출되는 최고 수준의 교육도시로 만들겠다”고 강조했다.그러면서 “화성시를 교육 특화지구로 지정하는 특별법을 추진하겠다”고 했다.이 대표는 “앞서 개혁신당이 발표한 수학교육 국가책임제를 도입하겠다. (이를 통해)수학 포기자가 없는 대한민국을 만들겠다”며 “공교육 부실의 결과를 더는 학부모 부담으로 전가하게 하지 않을 것”이라고 말했다.이 대표는 “권력자를 추종하며 좋은 감투를 쓰고 호의호식할 생각이었다면 애초에 이 길에 들어서지 않았을 것”이라며 “우리 개혁신당에게 힘을 실어 달라”고 호소했다.(화성=뉴스1)"
이화여대 “‘미군에 이대생 성상납’ 발언 김준혁 사퇴하라”,2024/04/02 15:22,"제22대 국회의원선거 수원정에 출마한 김준혁 더불어민주당 후보가 2일 경기도 수원시 매탄동에서 시민들에게 인사하며 지지를 호소하고 있다. 2024.04.02. 뉴시스더불어민주당 경기 수원정에 출마한 김준혁 후보가 과거 ‘김활란 이화여자대학교 초대 총장이 학생들을 미군 장교에게 성 상납시켰다’는 취지로 말한 사실이 알려져 논란이 된 가운데, 이화여대 측이 김 후보에 대해 법적 대응을 하겠다면서 후보직 사퇴를 촉구하고 나섰다.김 후보는 지난 2022년 8월 한 유튜브 채널에서 “종군 위안부를 보내는 데 큰 역할을 한 사람이 바로 김활란”이라며 “미군정 시기에 이화여대 학생들을 미군 장교들에게 성 상납시켰다”고 주장했다. 김 후보는 이보다 앞선 2017년 9월에는 수원 화성의 풍수지리학적 의미를 성적 대상화하는 발언을 했고, 2019년 2월엔 박정희 전 대통령이 위안부·학생과 성관계를 했다는 주장을 펴 논란이 된 바 있다.이에 이화여대는 2일 입장을 내고 “최근 유튜브와 언론 보도를 통해 공개된 김 후보의 본교 구성원에 대한 명예훼손 발언에 깊은 유감을 표한다”며 “검증되지 않은 자료와 억측으로 본교와 구성원의 명예를 훼손하는 행위에 대해선 법적으로 엄중히 대응할 방침”이라고 밝혔다.이어 “김 후보의 발언은 본교와 재학생·교수·동창의 명예를 심각하게 훼손하고 본교 이미지를 크게 실추시키고 있을 뿐만 아니라, 국회의원 후보자로서 가져선 안 되는 여성 차별적이고 왜곡된 시각을 바탕으로 당시 여성은 물론 현대의 여성에 이르는 전체 여성에 대한 명백한 비하 의도를 담고 있다”고 비판했다.그러면서 “김 후보가 지금이라도 자신의 발언과 태도에 대해 즉각 사과하고 후보직에서 물러날 것을 요구한다”고 목소리를 높였다.한편 김 후보는 같은 날 페이스북을 통해 “제 약점을 찾아냈다는 것이 제가 5~6년 전에 유튜브에 출연해 나눴던 발언을 꼬투리 삼아 앞뒤 다 자르고 성(性)과 관련된 자극적인 부분만 편집해 저와 민주당 전체를 매도하고 있다”고 반박했다.이어 “제 주장은 친일 인사들의 문제가 되는 행적, 특히 우리나라 여성들의 인권을 유린하고 성 착취를 강요했던 숨겨진 아픈 역사를 제대로 알자는 것”이라며 자신의 발언을 뒷받침할 논문과 기사 자료를 올린 블로그 링크를 첨부했다.김소영 동아닷컴 기자 sykim41@donga.com"
22대 총선 지역구 경쟁률 2.8:1…1985년 이후 최저,2024/03/23 15:33,"제22대 국회의원선거 후보자등록 신청일인 21일 서울 종로구 서울시선거관리위원회 입구에 관련 전광판이 설치돼 있다. 2024.3.21/뉴스1중앙선거관리위원회는 22대 총선 후보자 등록 결과 지역구 국회의원선거 후보자는 21개 정당에서 699명이 등록했다고 23일 밝혔다. 평균 2.8 대 1의 경쟁률로, 지난 총선 경쟁률(4.4:1)에 비해 낮은 수준이다. 지난 1985년 12대 총선에서 2.4대 1의 경쟁률 이후 39년만에 최저치다.정당별로 살펴보면 민주당 246명, 국민의힘 254명, 더불어민주연합 30명, 새로운미래 28명, 개혁신당 43명, 자유통일당 11명 순이다. 무소속은 58명이다.지역별로는 정치 1번지 서울 종로에서 최재형 국민의힘 후보, 곽상언 민주당 후보, 금태섭 개혁신당 후보 등 7명이 등록해 7대 1의 최고 경쟁률을 보였다.연령별로는 50대 후보가 315명(45%)으로 전체 후보자의 절반 가량을 차지했다. 반면 20대 후보는 4명에 그쳤다.성별로는 남성이 600명(85.8%)로, 여성 99명(14.1%)보다 6배 가량 많았다.총선에 출마한 후보자 가운데 3분의 1 이상인 242명(34.6%)이 전과가 있었다. 전과1범이 128명, 전과2범이 63명이었으며 전과 11범 이상 후보자도 1명 있었다.후보자가 신고한 재산은 10억원 이상 30억원 미만 후보자가 245명으로 가장 많았으며, 1억~5억원(130명), 5억~10억원(126명), 30억~50억원(65명) 순이었다.비례대표 국회의원선거는 38개 정당에서 253명이 등록했다. 비례대표 후보 경쟁률은 5.5:1이다. 비례대표연합에는 더불어민주연합 30명, 국민의미래 35명, 녹색정의당 145명, 새로운미래 11명, 개혁신당 10명, 자유통일당 20명, 조국혁신당 25명 등이 참여했다.한편 총선과 동시에 실시하는 재·보궐선거는 기초단체장 2개 선거구에 7명, 광역의회의원 17개 선거구에 44명, 기초의회의원 26개 선거구에 70명이 등록했다.후보자의 재산·병역·전과·학력·납세·공직선거 입후보경력은 선거일까지 중앙선관위 선거통계시스템(http://info.nec.go.kr)에 공개된다.정당·후보자가 제출하는 선거공보는 투표안내문과 함께 3월 31일까지 각 가정에 발송된다.(서울=뉴스1)"
이준석 “동탄을 대한민국 중심도시로”…호수공원서 화성을 출마 선언,2024/03/04 16:39,"이준석 개혁신당 대표가 4일 오후 경기도 화성시 정조로 동탄호수공원에서 제22대 국회의원선거 화성을 출마 선언을 하고 있다. 2024.3.4/뉴스1 ⓒ News1개혁신당 이준석 대표가 4일 “동탄을 대한민국의 중심 도시로 만들겠다”며 총선 출마를 공식 선언했다.이 대표는 이날 오후 화성시 동탄호수공원에서 기자회견을 열고 “개혁신당을 통해 완전히 새로운 동탄의 청사진이 태어날 것”이라며 “앞으로 동탄의 미래를 직접 만들어가는 정치를 해나겠다”고 약속했다.이어 “고교 비평준화 지역으로 많은 동탄 학부모들이 어려움을 겪고 있는데, 이 문제를 반드시 해결하겠다”면서 “경기남부에서 수많은 미래 과학 인재가 배출되는 최고 수준의 교육도시로 만들겠다”고 강조했다.그러면서 “화성시를 교육 특화지구로 지정하는 특별법 제정을 추진하겠다”고 했다.이 대표는 “앞서 개혁신당이 발표한 수학교육 국가책임체를 도입하겠다. (이를 통해)수학 포기자가 없는 대한민국을 만들겠다”며 “공교육 부실의 결과를 더는 학부모 부담으로 전가하게 하지 않을 것”이라고 말했다.한편 이날 출마선언에는 양향자 원내대표, 김용남 정책위의장, 이원욱 의원 등 개혁신당 주요인사들과 지지자들이 참석했다.(화성=뉴스1)"
"한 총리, 오세훈 시장과 투표소 점검…“한치의 실수·오점 안돼”",2024/04/09 15:53,"한덕수 국무총리와 오세훈 서울시장 등이 9일 서울 종로구 종로1.2.3.4가동 주민센터에 마련된 제22대 국회의원선거 투표소에서 현장 점검을 하고 있다. (공동취재) 2024.4.9/뉴스1 ⓒ News1한덕수 국무총리는 9일 제22대 국회의원 선거 투표를 하루 앞두고 “선거 관리에 있어서는 한 치의 실수나 오점이 있어서는 안 되며, 완전무결한 선거관리를 지원한다는 자세와 각오로 임해 주시기 바란다”고 오세훈 시장과 고기동 행정안전부 차관에게 당부했다.한 총리는 이날 오후 2시 서울시 종로1·2·3·4가동 행정복지센터 투표소를 방문해 선거사무 종사자를 격려하며 이같이 철저한 투표소 점검을 당부했다. 현장에는 오 시장과 고 차관, 여중협 행안부 자치분권국장, 이동률 서울시 행정국장 등이 함께했다.한 총리는 “사전투표에서 봤듯이, 우리 국민들의 이번 선거에 대한 열정이 엄청나게 강하다”며 “총 31.28% 유권자들이 사전투표를 마쳤지만 더 많은 투표를 할 국민들이 남아 있기 때문에 힘을 합쳐서 투표가 질서 있게, 공정하게 또 투명하게 이뤄지도록 최선을 다해야 한다”고 밝혔다.또한 한 총리는 이번 선거에서 선거의 공정성과 투명성을 위해 투표용지 수검표 절차가 새로 도입되고, 공무원 지원이 이전보다 늘어난 것에 대해서도 언급하며 “선거관리위원회와 경찰청, 소방청, 우리 행정안전부 같이 긴밀하게 협력을 해서 조그마한 차질도 있어서는 안 될 것”이라고 말했다.이어 “지난번 사전투표 때 총 411건 정도의 사건 사고가 있었습니다만, 그중에 한 80건이 넘는 그 숫자가 기기의 어떤 오작동에 있었다”며 “이런 일이 발생하지 않도록 거듭 노력을 해주시기 바란다”고 밝혔다.아울러 한 총리는 “많은 공무원이 투·개표 과정에 참여를 했기 때문에 이들에 대해서 투표가 끝난 뒤 국가가 의무적으로 휴무를 하도록 하는 일을 포함해 지원책이 마련됐다”며 “행안부를 중심으로 모든 부처가 이번에 개표과정에서 고생하는 공무원들에게 그런 지원책이 제대로 작동되도록 잘 살펴달라”고 말했다.이어 “불법카메라 사전적발, 행안부 중심 전수검사 등이 이뤄졌지만 국민이 투표권을 행사하는 선거날 관계부처간 협력해서 차질 없이 투표가 잘 진행되도록 힘써달라”고 밝혔다.(서울=뉴스1)"
"선관위 “고용주, 투표자 투표시간 청구 거절하면 과태료”",2024/04/02 10:09,"ⓒ뉴시스중앙선거관리위원회는 근로자가 제22대 국회의원선거 사전투표기간(5~6일)과 선거일(10일)에 모두 근무하는 경우 고용주에게 투표에 필요한 시간을 청구할 수 있다고 2일 밝혔다.공직선거법에 따르면 고용주는 근로자가 투표하기 위해 필요한 시간을 청구하면 이를 보장해 줘야 하고 정당한 사유 없이 이를 보장하지 않으면 1000만 원 이하의 과태료가 부과된다.공무원, 학생 또는 다른 사람에게 고용된 사람이 투표하기 위해 필요한 시간은 보장돼야 하며, 이를 휴무 또는 휴업으로 보지 아니한다고도 규정하고 있다.선관위는 지난달 고용노동부 등 중앙행정기관과 주요 직능·경제단체 등에 공문을 보내 근로자의 투표시간 청구권 등 보장 규정을 안내하고, 소속 임·직원과 산하 기관·단체의 근로자들이 투표권을 행사하는데 지장이 없도록 투표시간을 보장해 줄 것을 요청한 바 있다.[서울=뉴시스]"
